{
  "partition_id": 4,
  "title": "Upgrades and Maintenance",
  "description": "Articles about upgrading ROSA clusters and performing maintenance operations. Covers version upgrades, operator updates, upgrade failures, maintenance windows, pre-upgrade checks, upgrade requirements, downgrade limitations, and best practices for keeping clusters up-to-date and healthy.",
  "paths": [
    "kcs_solutions/4777861-is-it-possible-to-downgrade-a-version-in-openshift-container-platform-4.md",
    "kcs_solutions/6338121-why-is-clusternotupgradeable-firing-after-updating-to-ocp-4.8.md",
    "kcs_solutions/6365491-rosa-sts-4.7-clusters-are-prevented-from-upgrading-with-an-annotation-on-the-cloudcredential-customr.md",
    "kcs_solutions/6450191-clusternotupgradeable-and-adminackrequired-in-ocp-4.8.md",
    "kcs_solutions/6541901-rosa-4.8-clusters-require-user-action-before-scheduling-a-minor-version-upgrade.md",
    "kcs_solutions/6627971-error-while-trying-to-upgrade-rosa-cluster-to-4.9.md",
    "kcs_solutions/6656741-ocm,-rosa-cli-tokens-expiring-and-will-require-cli-tool-update.md",
    "kcs_solutions/6782601-failed-to-validate-role-polices-error-upgrading-rosa-4.8.md",
    "kcs_solutions/6838821-rosa-sts-no-account-roles-found-create-cluster.md",
    "kcs_solutions/6844191-rosa-cluster-upgrade-command-fails-due-to-aws-role-mismatch.md",
    "kcs_solutions/6970039-missingupgradeableannotation-cluster-operator-should-not-be-upgraded-between-minor-versions-in-osdro.md",
    "kcs_solutions/6970647-upgrade-maintenance-failed.md",
    "kcs_solutions/6976400-cluster-upgrade-is-not-possible-due-to-the-'alertmanager-main'-and-'prometheus-k8s'-pods-are-schedul.md",
    "kcs_solutions/6988198-rosa-4.11-clusters-require-user-action-before-scheduling-a-minor-version-upgrade.md",
    "kcs_solutions/6989139-how-to-open-a-proactive-case-for-rosa-classic,-rosa-hcp,-and-osd-cluster-maintenance-and-upgrades.md",
    "kcs_solutions/6991128-duplicate-of-the-rbac-permissions-operator-in-new-rosa-cluster..md",
    "kcs_solutions/6996536-machine-config-operator-is-degraded-due-to-failed-to-resync-4.9.23-because-timed-out-waiting-for-the.md",
    "kcs_solutions/6997370-upgrade-maintenance-delayed-or-failed-during-the-pre-health-check-in-osdrosa-cluster.md",
    "kcs_solutions/7003004-rosa-upgrade-via-openshift-webconsole-not-allowed-due-to-admission-webhook.md",
    "kcs_solutions/7003162-rosa-upgrade-fails-with-forbidden-access-to-update-resource.md",
    "kcs_solutions/7003915-openshift-web-console-doesn't-display-webhook-errors-for-upgrades.md",
    "kcs_solutions/7005463-rosa-4.12-clusters-require-user-action-before-scheduling-a-minor-version-upgrade.md",
    "kcs_solutions/7007847-how-to-upgrade-rosa-cluster-via-rosa-cli.md",
    "kcs_solutions/7018111-rosa-sts-roles-and-policies-prompt-to-update-to-the-latest-by-default.md",
    "kcs_solutions/7032365-unable-to-cancel-an-in-progress-openshift-4-cluster-upgrade.md",
    "kcs_solutions/7047753-technology-preview-supportability-dates-for-red-hat-openshift-service-on-aws-with-hosted-control-pla.md",
    "kcs_solutions/7065389-how-to-migrate-rosa-default-ingress-controllers-from-a-clb-to-nlb-after-upgrade-cluster-to-4.14.md",
    "kcs_solutions/7073068-custom-domains-convert-from-older-version-to-4.14-needs-to-setup-certification-manually.md",
    "kcs_solutions/7073120-how-to-reschedule-the-rosa-cluster-upgrade-using-rosa-cli.md",
    "kcs_solutions/7075425-pod-disruption-budget-slows-down-cluster-update.md",
    "kcs_solutions/7081067-when-starting-cluster-update,-the-nodes-in-paused-mcps-state-begin-updating-in-rhocp-4.md",
    "kcs_solutions/7081505-managed-openshift-upgrade-prehealthcheck-notifications-and-troubleshooting.md",
    "kcs_solutions/7086482-deleting-the-custom-domain-operator-in-rosaosd-4.14-and-later-is-not-supported.md",
    "kcs_solutions/7087106-critical-alerts-health-check-failed-while-cluster-upgrade.md",
    "kcs_solutions/7092997-rosa-hcp-cluster-machine-pools-upgrade-pending-long-time.md",
    "kcs_solutions/7092998-rosa-hcp-cluster-machine-pools-not-upgraded-to-expected-version.md",
    "kcs_solutions/7093001-rosa-hcp-cluster-upgrade-fail-because-of-openid-authentication-idp-error.md",
    "kcs_solutions/7093002-rosa-hcp-cluster-machine-pool-stuck-in-pending-state-because-of-kms-setting.md",
    "kcs_solutions/7103505-release-notes-for-aws-efs-csi-driver-operator.md",
    "kcs_solutions/7109434-rosa-cluster-upgrade-is-stuck-due-to-upgradenodedrainfailedsre.md",
    "kcs_solutions/7119477-missing-upgrade-version-even-when-path-is-available-on-upgrade-visualiser.md",
    "kcs_solutions/7128286-whether-or-not-two-versions-can-increase-the-minor-version-of-a-machine-pool-at-a-time.md",
    "kcs_solutions/7129428-mandatory-upgrades-for-rosa-with-hosted-control-planes-(hcp).md",
    "kcs_solutions/7133473-no-option-and-path-available-to-upgrade-cluster-from-4.17.x-to-4.18.z.md",
    "kcs_solutions/7134053-eus-channel-upgrade-procedure-for-rosa-hcp-and-rosa-classic.md"
  ],
  "entity_ontology": [],
  "relationship_ontology": []
}