{
  "partition_id": 1,
  "title": "ROSA Architecture and Policy",
  "description": "Documentation covering ROSA (Red Hat OpenShift Service on AWS) architecture, policy definitions, and service-level agreements. Includes technical specifications and compliance requirements.",
  "paths": [
    "openshift-docs/rosa_architecture/"
  ],
  "entity_ontology": [],
  "relationship_ontology": []
}